[{"title": "Data Scientist", "company": "KBR", "location": "Arlington", "description": "Title:\nData Scientist\n\nPosition Summary\n\nBelong. Connect. Grow. with KBR!\n\nOperations Research Analyst- Associate\n\nKBR\u2019s National Security Solutions team provides high-end engineering and advanced technology solutions to our customers in the intelligence and national security communities. In this position, your work will have a profound impact on the country\u2019s most critical role \u2013 protecting our national security.\n\nWhy Join Us?\n\u2022 Innovative Projects: Be part of a dynamic team that thrives on collaboration and innovation, fostering a supportive and intellectually stimulating workplace.\n\u2022 Collaborative Environment: Be part of a dynamic team that thrives on collaboration and innovation, fostering a supportive and intellectually stimulating workplace.\n\u2022 Impactful Work: Your contributions will be pivotal in successfully getting mission capability on orbit and shaping the future of space reconnaissance.\n\nKBR is looking for an energetic and innovative Data Scientist to assist in addressing gaps and discrepancies in sustainment-management reporting through the synchronization of multiple stakeholder requirements and the processing and analysis of sustainment data to develop and display operational readiness metrics and predictive analytics.\n\nAs a member of a team, the Data Scientist will be adept at processing and analyzing data from diverse static and automatic data sources, writing functions, creating \u201cwhat if\u201d scenario applications and creating machine learning and predictive analytics applications. Candidates must be comfortable working with a wide range of stakeholders and functional teams that work across multiple time zones and have a passion for discovering solutions hidden in large data sets. Candidates will have the opportunity to work with unstructured and structured data, develop databases, build data pipelines, and find innovative solutions to complex data problems.\n\nKey Responsibilities:\n\u2022 Research and apply state-of-the-art data mining methods and innovative statistical models\n\u2022 Use predictive analytics to calculate the potential impact of equipment downtime\n\u2022 Provide the ability to display metrics generated from automated data sources\n\u2022 Identify relevant data sources and sets to mine for client business needs and collect large structured and unstructured datasets and variables\n\u2022 Apply analytical tools to analyze large datasets and reveal connections between data elements and the underlying causes for observed behavior in the data\n\u2022 Process, cleanse, and verify the integrity of data used for analysis\n\u2022 Clearly document and present methodology, assumptions, and findings to stakeholders\n\nRequired Skills and Experience:\n\u2022 Bachelor\u2019s degree in Computer Science, Data Science, Operations Research or related discipline\n\u2022 Strong machine learning and predictive analysis skills\n\u2022 3-5 years of experience in a data science related discipline\n\u2022 Manipulating large data sets with SQL and Python\n\u2022 Experience with a cloud computing system such as ADVANA, ENVISION or PALANTIR\n\u2022 Documenting and communicating results of analysis\n\u2022 Experience manipulating data from spreadsheets (i.e. MS Excel)\n\u2022 Strong analytical and problem-solving skills with hands on experience driving analytic insights\n\u2022 Ability and motivation to self-teach in order to stay current with leading best practices in analytics\n\u2022 Expected to deliver in a fast-paced, team-oriented work environment\n\u2022 Must thrive in satisfying analytic requirements from diverse user base\n\u2022 Must have the knowledge and communication skills to articulate trade-offs between analytic techniques, recommend a course of action to clients, and provide effective updates on project outcome uncertainty to leadership\n\u2022 DoD SECRET or higher clearance\n\u2022 Ability to provide daily onsite support in Government offices in the National Capital Region\n\nPreferred Skills and Experience:\n\u2022 Apache Spark\n\u2022 Text mining and unstructured data analysis techniques\n\u2022 Machine Learning techniques\n\u2022 Language/Scripting skills: Python, Databricks Spark Compute\n\u2022 Tools: Qlik\n\u2022 Extract, Transform, Load (ETL) experience\n\u2022 Predictive and prescriptive analysis\n\u2022 Optimization experience\n\nWork Environment:\n\u2022 Location: On-site in Arlington, VA\n\u2022 Travel Requirements: Minimal less than 10% if necessary\n\u2022 Working Hours: Standard\n\nReady to Make a Difference?\n\nIf you\u2019re excited about making a significant impact in the field of space defense and working on projects that matter, we encourage you to apply and join our team at KBR. Let's shape the future together.\n\nBelong, Connect and Grow at KBR\n\nAt KBR, we are passionate about our people and our Zero Harm culture. These inform all that we do and are at the heart of our commitment to, and ongoing journey toward being a People First company. That commitment is central to our team of team\u2019s philosophy and fosters an environment where everyone can Belong, Connect and Grow. We Deliver \u2013 Together.\n\nKBR is an equal opportunity employer. All qualified applicants will receive consideration for employment without regard to race, color, religion, disability, sex, sexual orientation, gender identity or expression, age, national origin, veteran status, genetic information, union status and/or beliefs, or any other characteristic protected by federal, state, or local law.", "apply_link": "https://careers.kbr.com/us/en/job/R2115959/Data-Scientist?utm_campaign=google_jobs_apply&utm_source=google_jobs_apply&utm_medium=organic", "score": 0.8, "summary": "Skills Match (100%): Sql, Data Mining, Excel...", "skills": {"primary_skills": ["Cloud Computing", "Collaboration", "Communication", "Data Analysis", "Data Mining", "Data Pipelines", "Databricks", "ETL", "Excel", "Leadership", "Machine Learning", "Python", "Qlik", "SQL", "Spark", "Teams"], "secondary_skills": [], "all_skills": ["Cloud Computing", "Collaboration", "Communication", "Data Analysis", "Data Mining", "Data Pipelines", "Databricks", "ETL", "Excel", "Leadership", "Machine Learning", "Python", "Qlik", "SQL", "Spark", "Teams"], "skill_frequency": {"Python": 2, "SQL": 1, "Spark": 2, "Excel": 1, "Databricks": 1, "Qlik": 1, "Teams": 1, "Machine Learning": 3, "Data Analysis": 1, "ETL": 1, "Data Mining": 1, "Cloud Computing": 1, "Data Pipelines": 1, "Communication": 1, "Collaboration": 2, "Leadership": 1}, "total_count": 16}, "keywords": ["sql", "data mining", "excel", "python", "cloud computing"], "evidence_image": null}, {"title": "Data Scientist, Senior", "company": "BOOZ, ALLEN & HAMILTON, INC.", "location": "Alexandria", "description": "Data Scientist, Senior\nThe Opportunity:\n\nIn this role, you will apply data science techniques and methods and leverage a suite of data-driven tools to aid the client's service leadership and subject matter experts to increase decision space, understand strategic risk, and develop courses of action. Analysts employ expert judgment, adaptable methodologies, repeatable analytic processes, and enterprise-wide collaboration to provide routine, special interest, and alert-triggered campaign assessments, and when necessary, facilitate and synchronize enterprise-level campaign adjustment. You will help DoD senior leadership mobilize for long-term campaigning, marshal DoD resources and actions against desired strategic outcomes, and maneuver the department with greater precision and effect to persistently pursue opportunity and mitigate risk vis-a-vis the pacing rival. Analysts are tasked with utilizing a flexible and foundational toolset that will add value across campaigning topics. Analysts will blend functional area knowledge with an ability to identify data sources, manipulate data, use data analytics tools, understand and anticipate strategic intent, and communicate with senior DoD leaders.\n\nAs a data scientist, you're excited at the prospect of unlocking the secrets held by a data set, and you're fascinated by the possibilities presented by IoT, machine learning, and artificial intelligence. In an increasingly connected world, massive amounts of structured and unstructured data open new opportunities. As a data scientist at Booz Allen, you can turn these complex data sets into useful information to solve global challenges. Across private and public sectors from fraud detection to cancer research, to national intelligence, we need a seasoned data scientist like you to help find the answers in the data.\n\nOn our team, you'll use your leadership skills and data science expertise to create real-world impact. You'll work closely with clients to understand their questions and needs, and then dig into their data-rich environments to find the pieces of their information puzzle. You'll guide and mentor your team as you oversee the development of algorithms and systems. You'll use the right combination of tools and frameworks to turn sets of disparate data points into objective answers to advise your clients as they make informed decisions. As a technical leader, you'll identify new opportunities to use data science solutions to help your clients meet their toughest challenges. Ultimately, you'll provide a deep understanding of the data, what it all means, and how it can be used.\n\nWhat You'll Work On:\n\u2022 Design and execute statistical analyses on large, complex datasets from diverse sources.\n\u2022 Develop production-quality data visualizations, plots, and dashboards for technical and executive audiences.\n\u2022 Lead data science projects from scoping through delivery, ensuring analytical rigor and alignment with mission objectives.\n\u2022 Collaborate with stakeholders to translate strategic questions into analytical approaches and deliver actionable insights.\n\u2022 Respond to ad-hoc analytical requests while managing competing priorities and deadlines in an agile workflow.\n\u2022 Mentor junior data scientists and establish best practices for reproducible, well-documented analyses.\n\u2022 Communicate complex statistical findings to both technical teams and senior DoD leadership.\n\nJoin us. The world can't wait.\n\nYou Have:\n\u2022 7+ years of experience with data science, statistical analysis, or quantitative research\n\u2022 7+ years of experience with the development of algorithms leveraging R or Python in data analysis libraries, including pandas, NumPy, scikit-learn, or tidyverse\n\u2022 7+ years of experience analyzing structured and unstructured data sources\n\u2022 Experience with statistics, including hypothesis testing, regression analysis, experimental design, and uncertainty quantification\n\u2022 Experience with data management in SQL, including managing large-scale data across multiple databases and data warehouses\n\u2022 Experience working with large-scale datasets and distributed computing frameworks, including Spark or DASK\n\u2022 TS/SCI clearance\n\u2022 Master's degree\n\nNice If You Have:\n\u2022 Experience with natural language processing (NLP) techniques, such as text classification or entity recognition\n\u2022 Experience with geospatial data analysis\n\u2022 Experience with Databricks for data science workflows, including building and scaling analytical pipelines, collaborating in notebooks, and integrating with Spark for large-scale data processing\n\u2022 Experience with data engineering principles, including ETL design, orchestration, and data pipeline architecture, to effectively partner with engineering teams\n\u2022 Experience working with the U.S. Department of Defense or the Intelligence Community\n\u2022 Experience with graph analytics, network analysis, or anomaly detection techniques\n\u2022 Experience with version control (Git) and reproducible research practices\n\u2022 Knowledge of machine learning model development and deployment practices\n\u2022 Possession of excellent written and verbal communication skills\n\u2022 Doctorate degree in Statistics, Computer Science, Data Science, or Economics\n\nClearance:\n\nApplicants selected will be subject to a security investigation and may need to meet eligibility requirements for access to classified information; TS/SCI clearance is required.\n\nCompensation\n\nAt Booz Allen, we celebrate your contributions, provide you with opportunities and choices, and support your total well-being. Our offerings include health, life, disability, financial, and retirement benefits, as well as paid leave, professional development, tuition assistance, work-life programs, and dependent care. Our recognition awards program acknowledges employees for exceptional performance and superior demonstration of our values. Full-time and part-time employees working at least 20 hours a week on a regular basis are eligible to participate in Booz Allen's benefit programs. Individuals that do not meet the threshold are only eligible for select offerings, not inclusive of health benefits. We encourage you to learn more about our total benefits by visiting the Resource page on our Careers site and reviewing Our Employee Benefits page.\n\nSalary at Booz Allen is determined by various factors, including but not limited to location, the individual's particular combination of education, knowledge, skills, competencies, and experience, as well as contract-specific affordability and organizational requirements. The projected compensation range for this position is $99,000.00 to $225,000.00 (annualized USD). The estimate displayed represents the typical salary range for this position and is just one component of Booz Allen's total compensation package for employees. This posting will close within 90 days from the Posting Date.\n\nIdentity Statement\n\nAs part of the application process, you are expected to be on camera during interviews and assessments. We reserve the right to take your picture to verify your identity and prevent fraud.\n\nWork Model\nOur people-first culture prioritizes the benefits of flexibility and collaboration, whether that happens in person or remotely.\n\u2022 If this position is listed as remote or hybrid, you'll periodically work from a Booz Allen or client site facility.\n\u2022 If this position is listed as onsite, you'll work with colleagues and clients in person, as needed for the specific role.\n\nCommitment to Non-Discrimination\n\nAll qualified applicants will receive consideration for employment without regard to disability, status as a protected veteran or any other status protected by applicable federal, state, local, or international law.", "apply_link": "https://www.ziprecruiter.com/c/Booz-Allen-Hamilton/Job/Data-Scientist,-Senior/-in-Alexandria,VA?jid=a13e44c08e4f77e6&utm_campaign=google_jobs_apply&utm_source=google_jobs_apply&utm_medium=organic", "score": 0.8, "summary": "Skills Match (100%): Regression Analysis, Sql, Pandas...", "skills": {"primary_skills": ["Agile", "Classification", "Collaboration", "Communication", "Dask", "Data Analysis", "Data Engineering", "Databricks", "ETL", "Flexibility", "Git", "Hypothesis Testing", "Leadership", "Machine Learning", "NLP", "NumPy", "Pandas", "Python", "R", "Regression Analysis", "SQL", "Spark", "Teams", "Verbal Communication", "scikit-learn"], "secondary_skills": [], "all_skills": ["Agile", "Classification", "Collaboration", "Communication", "Dask", "Data Analysis", "Data Engineering", "Databricks", "ETL", "Flexibility", "Git", "Hypothesis Testing", "Leadership", "Machine Learning", "NLP", "NumPy", "Pandas", "Python", "R", "Regression Analysis", "SQL", "Spark", "Teams", "Verbal Communication", "scikit-learn"], "skill_frequency": {"Python": 1, "R": 1, "SQL": 1, "scikit-learn": 1, "Pandas": 1, "NumPy": 1, "Spark": 2, "Databricks": 1, "Dask": 1, "Git": 2, "Teams": 2, "Machine Learning": 2, "NLP": 2, "Data Analysis": 2, "ETL": 1, "Agile": 1, "Data Engineering": 1, "Hypothesis Testing": 1, "Regression Analysis": 1, "Classification": 1, "Communication": 1, "Verbal Communication": 1, "Collaboration": 2, "Leadership": 4, "Flexibility": 1}, "total_count": 25}, "keywords": ["regression analysis", "sql", "pandas", "numpy", "git"], "evidence_image": null}, {"title": "Data Scientist (Remote)", "company": "Elder Research", "location": "Arlington", "description": "Job Title: Data Scientist\n\nWorkplace: Remote (preference for candidates located in the National Capital Region - DMV)\n\nClearance Required: a TS or CBP BI or DHS Suitability clearance adjudicated within the past 4 years\n\nPosition Overview:\n\nSupports U.S. Customs and Border Protection. As a Data Scientist, with little or no supervision, apply expert knowledge in statistical analysis, complex data mining, and artificial intelligence to make value out of data. Provide consulting relating to the data mining and analysis of data from a range of sources to transform raw data into concise and actionable insights. Design and implement data-driven solutions, with specific focus on advanced analytical methods, data models, and visualizations. Develop quantitative simulations and models to provide descriptive and predictive analytics solution recommendations. Identify trends and problems through complex big data analysis. Maintain current in emerging tools and techniques in machine learning, statistical modeling, and analytics.\n\nRequirements:\n\u2022 Six (6) years of relevant experience in applied research, big data analytics, statistics, applied mathematics, data science, computer science, operations research or other closely related other quantitative or mathematical discipline. At least three (3) years of direct experience in machine learning.\n\u2022 Advanced Degree (Masters or PhD) in Statistics, Applied Mathematics, Data Science, Computer Science, Operations Research or other closely related other quantitative or mathematical discipline. A PhD degree may be substituted for up to three (3) years of relevant experience.\n\u2022 Demonstrates knowledge of data mining methods, databases, data visualization and machine learning.\n\u2022 Ability to communicate analysis techniques, concepts and products.\n\u2022 Ability to develop data-driven solutions, data models, and visualizations\n\nPreferred Experience and Skills:\n\u2022 Expertise using Qlik to embed visualizations into webpages\n\u2022 Familiarity with Databricks or similar cloud-based distributed database technologies\n\u2022 Familiarity with PySpark and Python\n\u2022 Comfortable developing complex SQL queries to extract, transform, and load data\n\u2022 Experience with analytic techniques such as Anomaly detection, Clustering, and Time-series (e.g., ARIMA)\n\u2022 Experience implementing NLP concepts including preprocessing (stemming, etc.), TF-IDF, Named Entity Recognition, and LLMs.\n\nWhy apply to this position at Elder Research?\n\u2022 Competitive Salary and Benefits\n\u2022 Important Work / Make a Difference: supporting Customs and Border Protection in their efforts to protect the United States.\n\u2022 Job Stability: Elder Research is not a typical government contractor, we hire you for a career not just a contract.\n\u2022 Remote Work: in an industry of declining remote work opportunities.\n\u2022 People-Focused Culture: we prioritize work-life-balance and provide a positive, supportive work environment as well as opportunities for professional growth and advancement.\n\u2022 Company Stock Ownership: all employees are provided with shares of the company each year based on company value and profits.\n\nAbout Elder Research, Inc\n\nPeople Centered. Data Driven\n\nElder Research is a fast growing consulting firm specializing in predictive analytics. Being in the data mining business almost 30 years, we pride ourselves in our ability to find creative, cutting edge solutions to real-world problems. We work hard to provide the best value to our clients and allow each person to contribute their ideas and put their skills to use immediately.\n\nOur team members are passionate, curious, life-long learners. We value humility, servant-leadership, teamwork, and integrity. We seek to serve our clients and our teammates to the best of our abilities. In keeping with our entrepreneurial spirit, we want candidates who are self-motivated with an innate curiosity and strong team work.\n\nElder Research believes in continuous learning and community - each week the entire company attends a \u201cTech Talk\u201d and each office location provides lunch. Elder Research provides a supportive work environment with established parental, bereavement, and PTO policies. By prioritizing a healthy work-life balance - with reasonable hours, solid pay, low travel, and extremely flexible time off - Elder Research enables and encourages its employees to serve others and enjoy their lives.\n\nElder Research, Inc. is an Equal Opportunity Employer. All qualified applicants will receive consideration for employment without regard to race, color, religion, sex, sexual orientation, gender identity, national origin, or protected veteran status and will not be discriminated against on the basis of disability.\n\nElder Research is a Government contractor and many of our positions require US Citizenship.", "apply_link": "https://www.indeed.com/viewjob?jk=648d8cec2def9e06&utm_campaign=google_jobs_apply&utm_source=google_jobs_apply&utm_medium=organic", "score": 0.8, "summary": "Skills Match (100%): Sql, Clustering, Data Mining...", "skills": {"primary_skills": ["Big Data", "Clustering", "Data Analysis", "Data Mining", "Data Visualization", "Databricks", "Leadership", "Machine Learning", "NLP", "Ownership", "Python", "Qlik", "SQL", "Statistical Modeling", "Teamwork"], "secondary_skills": [], "all_skills": ["Big Data", "Clustering", "Data Analysis", "Data Mining", "Data Visualization", "Databricks", "Leadership", "Machine Learning", "NLP", "Ownership", "Python", "Qlik", "SQL", "Statistical Modeling", "Teamwork"], "skill_frequency": {"Python": 1, "SQL": 1, "Databricks": 1, "Qlik": 1, "Machine Learning": 3, "NLP": 1, "Data Analysis": 1, "Statistical Modeling": 1, "Data Visualization": 1, "Big Data": 2, "Data Mining": 4, "Clustering": 1, "Teamwork": 1, "Leadership": 1, "Ownership": 1}, "total_count": 15}, "keywords": ["sql", "clustering", "data mining", "python", "nlp"], "evidence_image": null}, {"title": "Data Scientist Jobs", "company": "KBR", "location": "Arlington", "description": "Title:\nData Scientist\n\nPosition Summary\n\nBelong. Connect. Grow. with KBR!\n\nOperations Research Analyst- Associate\n\nKBR's National Security Solutions team provides high-end engineering and advanced technology solutions to our customers in the intelligence and national security communities. In this position, your work will have a profound impact on the country's most critical role - protecting our national security.\n\nWhy Join Us?\n\u2022 Innovative Projects: Be part of a dynamic team that thrives on collaboration and innovation, fostering a supportive and intellectually stimulating workplace.\n\u2022 Collaborative Environment: Be part of a dynamic team that thrives on collaboration and innovation, fostering a supportive and intellectually stimulating workplace.\n\u2022 Impactful Work: Your contributions will be pivotal in successfully getting mission capability on orbit and shaping the future of space reconnaissance.\n\nKBR is looking for an energetic and innovative Data Scientist to assist in addressing gaps and discrepancies in sustainment-management reporting through the synchronization of multiple stakeholder requirements and the processing and analysis of sustainment data to develop and display operational readiness metrics and predictive analytics.\n\nAs a member of a team, the Data Scientist will be adept at processing and analyzing data from diverse static and automatic data sources, writing functions, creating \"what if\" scenario applications and creating machine learning and predictive analytics applications. Candidates must be comfortable working with a wide range of stakeholders and functional teams that work across multiple time zones and have a passion for discovering solutions hidden in large data sets. Candidates will have the opportunity to work with unstructured and structured data, develop databases, build data pipelines, and find innovative solutions to complex data problems.\n\nKey Responsibilities:\n\u2022 Research and apply state-of-the-art data mining methods and innovative statistical models\n\u2022 Use predictive analytics to calculate the potential impact of equipment downtime\n\u2022 Provide the ability to display metrics generated from automated data sources\n\u2022 Identify relevant data sources and sets to mine for client business needs and collect large structured and unstructured datasets and variables\n\u2022 Apply analytical tools to analyze large datasets and reveal connections between data elements and the underlying causes for observed behavior in the data\n\u2022 Process, cleanse, and verify the integrity of data used for analysis\n\u2022 Clearly document and present methodology, assumptions, and findings to stakeholders\n\nRequired Skills and Experience:\n\u2022 Bachelor's degree in Computer Science, Data Science, Operations Research or related discipline\n\u2022 Strong machine learning and predictive analysis skills\n\u2022 3-5 years of experience in a data science related discipline\n\u2022 Manipulating large data sets with SQL and Python\n\u2022 Experience with a cloud computing system such as ADVANA, ENVISION or PALANTIR\n\u2022 Documenting and communicating results of analysis\n\u2022 Experience manipulating data from spreadsheets (i.e. MS Excel)\n\u2022 Strong analytical and problem-solving skills with hands on experience driving analytic insights\n\u2022 Ability and motivation to self-teach in order to stay current with leading best practices in analytics\n\u2022 Expected to deliver in a fast-paced, team-oriented work environment\n\u2022 Must thrive in satisfying analytic requirements from diverse user base\n\u2022 Must have the knowledge and communication skills to articulate trade-offs between analytic techniques, recommend a course of action to clients, and provide effective updates on project outcome uncertainty to leadership\n\u2022 DoD SECRET or higher clearance\n\u2022 Ability to provide daily onsite support in Government offices in the National Capital Region\n\nPreferred Skills and Experience:\n\u2022 Apache Spark\n\u2022 Text mining and unstructured data analysis techniques\n\u2022 Machine Learning techniques\n\u2022 Language/Scripting skills: Python, Databricks Spark Compute\n\u2022 Tools: Qlik\n\u2022 Extract, Transform, Load (ETL) experience\n\u2022 Predictive and prescriptive analysis\n\u2022 Optimization experience\n\nWork Environment:\n\u2022 Location: On-site in Arlington, VA\n\u2022 Travel Requirements: Minimal less than 10% if necessary\n\u2022 Working Hours: Standard\n\nReady to Make a Difference?\n\nIf you're excited about making a significant impact in the field of space defense and working on projects that matter, we encourage you to apply and join our team at KBR. Let's shape the future together.\n\nBelong, Connect and Grow at KBR\n\nAt KBR, we are passionate about our people and our Zero Harm culture. These inform all that we do and are at the heart of our commitment to, and ongoing journey toward being a People First company. That commitment is central to our team of team's philosophy and fosters an environment where everyone can Belong, Connect and Grow. We Deliver - Together.\n\nKBR is an equal opportunity employer. All qualified applicants will receive consideration for employment without regard to race, color, religion, disability, sex, sexual orientation, gender identity or expression, age, national origin, veteran status, genetic information, union status and/or beliefs, or any other characteristic protected by federal, state, or local law.", "apply_link": "https://www.clearancejobs.com/jobs/8652164/data-scientist?utm_campaign=google_jobs_apply&utm_source=google_jobs_apply&utm_medium=organic", "score": 0.8, "summary": "Skills Match (100%): Sql, Data Mining, Excel...", "skills": {"primary_skills": ["Cloud Computing", "Collaboration", "Communication", "Data Analysis", "Data Mining", "Data Pipelines", "Databricks", "ETL", "Excel", "Leadership", "Machine Learning", "Python", "Qlik", "SQL", "Spark", "Teams"], "secondary_skills": [], "all_skills": ["Cloud Computing", "Collaboration", "Communication", "Data Analysis", "Data Mining", "Data Pipelines", "Databricks", "ETL", "Excel", "Leadership", "Machine Learning", "Python", "Qlik", "SQL", "Spark", "Teams"], "skill_frequency": {"Python": 2, "SQL": 1, "Spark": 2, "Excel": 1, "Databricks": 1, "Qlik": 1, "Teams": 1, "Machine Learning": 3, "Data Analysis": 1, "ETL": 1, "Data Mining": 1, "Cloud Computing": 1, "Data Pipelines": 1, "Communication": 1, "Collaboration": 2, "Leadership": 1}, "total_count": 16}, "keywords": ["sql", "data mining", "excel", "python", "cloud computing"], "evidence_image": null}, {"title": "Data Scientist - Multiple levels - Required TS/SCI", "company": "Leidos", "location": "Reston", "description": "Description\n\nThe Mission Solutions Business Area at Leidos has an opening for a Data Scientist in Reston, Virginia to support a fast-paced software development team working on projects critical to National Security. The primary focus of the group is reverse engineering Weapons of Mass Destruction (WMD) related installations. Candidate must bring a creative, yet sound, approach to identifying and solving challenges, and have exceptional attention to detail and a commitment to thoroughness The successful candidate will have experience in statistical analysis, data ingestion/processing, and experience with methods/analytics development, to support our customer\u2019s data analytics program. You will work as part of a team to support the verification and validation of computer assisted product development and to present the results to the customer.\n\nRole and Responsibility:\n\nThe candidate shall perform the following as part of a larger team:\n\u2022 Build statistical models, test hypotheses, interpret, summarize, visualize, and succinctly report on data findings\n\u2022 Perform research on various data sources, to include unstructured data using quantitative and qualitative content analytics\n\u2022 Construct and perform complex database search queries in multiple databases using SQL and API interfaces\n\u2022 Perform web scraping and apply various techniques for processing unstructured data. The Scientist will leverage automation and machine learning to manage data, predict scenarios and make recommendations.\n\u2022 Contribute to building new analytical tools and packages across the enterprise and will be expected to collaborate with team members in a highly technical environment\n\u2022 Learn and leverage emerging technologies including AWS and Git\n\u2022 Excellent written and verbal communication skills with the ability to successfully brief and interact with personnel at all levels of experience, including Senior Officials\n\nRequirements and Qualifications:\n\u2022 US Citizenship is required\n\u2022 Candidate must possess an active TS/SCI, or a Top Secret clearance with a current SSBI, and be eligible to obtain a TS/SCI w/ poly level clearance\n\u2022 BS degree and >6 years of prior relevant experience or MS with >4 years of prior relevant experience. May possess a Doctorate in a technical domain\n\u2022 Must have a Data Science, Operations Research or related degree\n\u2022 Strong experience with Python\n\u2022 Experience working with data manipulation, analytic/business insight tools, and data visualization experience\n\u2022 Experience constructing and performing complex database search queries\n\u2022 Experience/knowledge of computer science concepts, data architecture, and experience/knowledge of statistics\n\u2022 Demonstrated experience using statistical and machine learning techniques including supervised and unsupervised learning and natural language processing\n\u2022 Experience/familiarity with frequentist statistics and probability including predicative modeling\n\u2022 Ability to communicate technical findings to non-technical audiences\n\nPreferred Qualifications:\n\u2022 Experience with spatial (3D) or building infrastructure (e.g. electrical, HVAC systems) data\n\u2022 Experience with AI model development\n\u2022 Experience with Defense Intelligence Agency computer systems and data management processes\n\nIf you're looking for comfort, keep scrolling. At Leidos, we outthink, outbuild, and outpace the status quo \u2014 because the mission demands it. We're not hiring followers. We're recruiting the ones who disrupt, provoke, and refuse to fail. Step 10 is ancient history. We're already at step 30 \u2014 and moving faster than anyone else dares.\n\nOriginal Posting:\nSeptember 24, 2025\n\nFor U.S. Positions: While subject to change based on business needs, Leidos reasonably anticipates that this job requisition will remain open for at least 3 days with an anticipated close date of no earlier than 3 days after the original posting date as listed above.\n\nPay Range:\nPay Range $104,650.00 - $189,175.00\n\nThe Leidos pay range for this job level is a general guideline only and not a guarantee of compensation or salary. Additional factors considered in extending an offer include (but are not limited to) responsibilities of the job, education, experience, knowledge, skills, and abilities, as well as internal equity, alignment with market data, applicable bargaining agreement (if any), or other law.\n\nAbout Leidos\n\nLeidos is an industry and technology leader serving government and commercial customers with smarter, more efficient digital and mission innovations. Headquartered in Reston, Virginia, with 47,000 global employees, Leidos reported annual revenues of approximately $16.7 billion for the fiscal year ended January 3, 2025. For more information, visit www.Leidos.com.\n\nPay and Benefits\n\nPay and benefits are fundamental to any career decision. That's why we craft compensation packages that reflect the importance of the work we do for our customers. Employment benefits include competitive compensation, Health and Wellness programs, Income Protection, Paid Leave and Retirement. More details are available at www.leidos.com/careers/pay-benefits.\n\nSecuring Your Data\n\nBeware of fake employment opportunities using Leidos\u2019 name. Leidos will never ask you to provide payment-related information during any part of the employment application process (i.e., ask you for money), nor will Leidos ever advance money as part of the hiring process (i.e., send you a check or money order before doing any work). Further, Leidos will only communicate with you through emails that are generated by the Leidos.com automated system \u2013 never from free commercial services (e.g., Gmail, Yahoo, Hotmail) or via WhatsApp, Telegram, etc. If you received an email purporting to be from Leidos that asks for payment-related information or any other personal information (e.g., about you or your previous employer), and you are concerned about its legitimacy, please make us aware immediately by emailing us at LeidosCareersFraud@leidos.com.\n\nIf you believe you are the victim of a scam, contact your local law enforcement and report the incident to the U.S. Federal Trade Commission.\n\nCommitment to Non-Discrimination\n\nAll qualified applicants will receive consideration for employment without regard to sex, race, ethnicity, age, national origin, citizenship, religion, physical or mental disability, medical condition, genetic information, pregnancy, family structure, marital status, ancestry, domestic partner status, sexual orientation, gender identity or expression, veteran or military status, or any other basis prohibited by law. Leidos will also consider for employment qualified applicants with criminal histories consistent with relevant laws.", "apply_link": "https://careers.leidos.com/jobs/16836302-data-scientist-multiple-levels-required-ts-slash-sci?utm_campaign=google_jobs_apply&utm_source=google_jobs_apply&utm_medium=organic", "score": 0.8, "summary": "Skills Match (100%): Sql, Python, Nlp...", "skills": {"primary_skills": ["AWS", "Attention to Detail", "Communication", "Data Visualization", "Git", "Machine Learning", "NLP", "Python", "SQL", "Search", "Verbal Communication", "Web Scraping"], "secondary_skills": [], "all_skills": ["AWS", "Attention to Detail", "Communication", "Data Visualization", "Git", "Machine Learning", "NLP", "Python", "SQL", "Search", "Verbal Communication", "Web Scraping"], "skill_frequency": {"Python": 1, "SQL": 1, "AWS": 1, "Git": 2, "Machine Learning": 2, "Data Visualization": 1, "NLP": 1, "Web Scraping": 1, "Communication": 1, "Verbal Communication": 1, "Attention to Detail": 1, "Search": 2}, "total_count": 12}, "keywords": ["sql", "python", "nlp", "search", "git"], "evidence_image": null}, {"title": "Data Scientist", "company": "Leidos", "location": "McLean", "description": "Description\n\nLeidos has a new and exciting opportunity for a Data Scientist in our National Security Sector's (NSS) Cyber & Analytics Business Area (CABA) located in McLean, VA. Our talented team is at the forefront in Security Engineering, Computer Network Operations (CNO), Mission Software, Analytical Methods and Modeling, Signals Intelligence (SIGINT), and Cryptographic Key Management. At Leidos, we offer competitive benefits, including Paid Time Off, 11 paid Holidays, 401K with a 6% company match and immediate vesting, Flexible Schedules, Discounted Stock Purchase Plans, Technical Upskilling, Education and Training Support, Parental Paid Leave, and much more. Join us and make a difference in National Security!\n\nJob Summary:\n\nWe are looking for a Data Scientist with an entrepreneur\u2019s mindset to support a fast-paced and growing data science team working on projects critical to National Security.\n\nResponsibilities Include:\n\u2022 Build statistical and machine learning models, conducting natural language processing (NLP), and developing automated solutions for complex business challenges.\n\u2022 Construct and execute complex database search queries across multiple databases using SQL and API interfaces.\n\u2022 Perform web scraping and apply various techniques for processing unstructured data.\n\u2022 Leverage automation and machine learning to manage data, predict scenarios, and make data-driven recommendations.\n\u2022 Learn and leverage technologies including AWS and Git.\n\nBasic Qualifications:\n\u2022 Must have TS/SCI with Polygraph.\n\u2022 BS degree and 8 \u2013 12 years of prior relevant experience or Masters with 6 \u2013 10 years of prior relevant experience. May possess a Doctorate in technical domain.\n\u2022 Experience with Python is required.\n\u2022 Strong SQL skills and experience with relational databases and APIs for data extraction is required.\n\u2022 Experience with supervised and unsupervised learning and natural language processing (NLP) is required. Familiarity with NLP libraries and tools (e.g., spaCy, Hugging Face, NLTK, or TensorFlow).\n\u2022 Experience with frequentist statistics, probability, and predictive modeling, along with knowledge of computer science concepts, data architecture, and statistical methods.\n\u2022 Proficiency with data visualization tools (e.g., Tableau, Plotly, Seaborn, Matplotlib) is required.\n\nAt Leidos, the opportunities are boundless. We challenge our staff with interesting assignments that allow them to thrive professionally and personally. For us, helping you grow your career is good business. We look forward to learning more about you \u2013 apply today.\n\nIf you're looking for comfort, keep scrolling. At Leidos, we outthink, outbuild, and outpace the status quo \u2014 because the mission demands it. We're not hiring followers. We're recruiting the ones who disrupt, provoke, and refuse to fail. Step 10 is ancient history. We're already at step 30 \u2014 and moving faster than anyone else dares.\n\nOriginal Posting:\nSeptember 25, 2025\n\nFor U.S. Positions: While subject to change based on business needs, Leidos reasonably anticipates that this job requisition will remain open for at least 3 days with an anticipated close date of no earlier than 3 days after the original posting date as listed above.\n\nPay Range:\nPay Range $104,650.00 - $189,175.00\n\nThe Leidos pay range for this job level is a general guideline only and not a guarantee of compensation or salary. Additional factors considered in extending an offer include (but are not limited to) responsibilities of the job, education, experience, knowledge, skills, and abilities, as well as internal equity, alignment with market data, applicable bargaining agreement (if any), or other law.\n\nAbout Leidos\n\nLeidos is an industry and technology leader serving government and commercial customers with smarter, more efficient digital and mission innovations. Headquartered in Reston, Virginia, with 47,000 global employees, Leidos reported annual revenues of approximately $16.7 billion for the fiscal year ended January 3, 2025. For more information, visit www.Leidos.com.\n\nPay and Benefits\n\nPay and benefits are fundamental to any career decision. That's why we craft compensation packages that reflect the importance of the work we do for our customers. Employment benefits include competitive compensation, Health and Wellness programs, Income Protection, Paid Leave and Retirement. More details are available at www.leidos.com/careers/pay-benefits.\n\nSecuring Your Data\n\nBeware of fake employment opportunities using Leidos\u2019 name. Leidos will never ask you to provide payment-related information during any part of the employment application process (i.e., ask you for money), nor will Leidos ever advance money as part of the hiring process (i.e., send you a check or money order before doing any work). Further, Leidos will only communicate with you through emails that are generated by the Leidos.com automated system \u2013 never from free commercial services (e.g., Gmail, Yahoo, Hotmail) or via WhatsApp, Telegram, etc. If you received an email purporting to be from Leidos that asks for payment-related information or any other personal information (e.g., about you or your previous employer), and you are concerned about its legitimacy, please make us aware immediately by emailing us at LeidosCareersFraud@leidos.com.\n\nIf you believe you are the victim of a scam, contact your local law enforcement and report the incident to the U.S. Federal Trade Commission.\n\nCommitment to Non-Discrimination\n\nAll qualified applicants will receive consideration for employment without regard to sex, race, ethnicity, age, national origin, citizenship, religion, physical or mental disability, medical condition, genetic information, pregnancy, family structure, marital status, ancestry, domestic partner status, sexual orientation, gender identity or expression, veteran or military status, or any other basis prohibited by law. Leidos will also consider for employment qualified applicants with criminal histories consistent with relevant laws.", "apply_link": "https://careers.leidos.com/jobs/16841026-data-scientist?utm_campaign=google_jobs_apply&utm_source=google_jobs_apply&utm_medium=organic", "score": 0.79, "summary": "Skills Match (100%): Hugging Face, Tensorflow, Spacy...", "skills": {"primary_skills": ["AWS", "Data Visualization", "Git", "Hugging Face", "Machine Learning", "NLP", "NLTK", "Python", "SQL", "Search", "Tableau", "TensorFlow", "Web Scraping", "spaCy"], "secondary_skills": [], "all_skills": ["AWS", "Data Visualization", "Git", "Hugging Face", "Machine Learning", "NLP", "NLTK", "Python", "SQL", "Search", "Tableau", "TensorFlow", "Web Scraping", "spaCy"], "skill_frequency": {"Python": 1, "SQL": 2, "TensorFlow": 1, "Hugging Face": 1, "NLTK": 1, "spaCy": 1, "Tableau": 1, "AWS": 1, "Git": 2, "Machine Learning": 2, "NLP": 5, "Data Visualization": 1, "Web Scraping": 1, "Search": 1}, "total_count": 14}, "keywords": ["hugging face", "tensorflow", "spacy", "sql", "tableau"], "evidence_image": null}, {"title": "Data Scientist IV", "company": "Battelle", "location": "Fort Belvoir", "description": "Battelle delivers when others can\u2019t. We conduct research and development, manage national laboratories, design and manufacture products and deliver critical services for our clients\u2014whether they are a multi-national corporation, a small start-up or a government agency.\n\nWe recognize and appreciate the value and contributions of individuals from a wide range of backgrounds and experiences and welcome all qualified individuals to apply.\nJob Summary\n\nBattelle\u2019s National Security Business Unit is seeking experienced Geospatial Researchers/Data Scientists to support cutting-edge research and development activities for the Army Geospatial Center and ERDC\u2019s Geospatial Research Laboratory. This position is remote, with flexible work location, and supports client activities at Ft. Belvoir, VA. Battelle offers a comprehensive benefits package including health, dental, vision, and life insurance, 401k, pension plan, and tuition reimbursement. Compensation is commensurate with qualifications and experience.\n\nThe Geospatial Research Laboratory (GRL) conducts advanced geospatial research, development, testing, and evaluation of current and emerging technologies to characterize and measure phenomena within both physical (terrain) and social (cultural) environments encountered by the U.S. Army. Research supports the Army Geospatial Enterprise and the development of geospatially enabled technologies for Joint, other Services, and Functional Combatant Command (COCOM) programs, with additional applications in military engineering, DoD installation management, and USACE projects.\n\nDeliverable:\nThe primary deliverable for this position is the development of well-formed, 3D urban-relevant models that are effective for operational applications and exhibit smart reduction techniques, enabling sharing in low-bandwidth environments. These models must be optimized for use in Army tactical systems, with priority metrics including rapid development timelines, minimized file sizes, and high utility in operational contexts.\n\nResponsibilities\n\u2022 Review scientific literature to identify and implement appropriate research methods.\n\u2022 Extract, organize, and analyze data from diverse databases and files at varying scales.\n\u2022 Develop software tools utilizing statistical and machine learning techniques.\n\u2022 Critically evaluate data for completeness, accuracy, and applicability.\n\u2022 Communicate technical results clearly, emphasizing data visualization.\n\u2022 Collaborate effectively with co-located and geographically diverse team members.\n\u2022 Author and contribute to technical reports and presentations, including tables, graphs, and software tools.\n\u2022 Implement methodologies to solve complex geospatial problems.\n\u2022 Develop and optimize 3D urban models for operational use, focusing on smart reduction for low-bandwidth sharing and integration with Army tactical systems.\n\nKey Qualifications\n\u2022 Experience/knowledge in photogrammetry and remote sensing.\n\u2022 Coding expertise (Python preferred), with a focus on open-source software.\n\u2022 Experience collecting and processing point cloud data from LiDAR and EO sensor systems (aerial, terrestrial, mobile).\n\u2022 Proficiency with 3D data visualization/manipulation software (ArcGIS Pro, QGIS, Cloud Compare, QT Modeler, Meshlab, Agisoft Metashape, RealityCapture, Blender, Unreal, Unity).\n\u2022 Familiarity with 3D mesh generation and texturing (OBJ, glTF formats).\n\u2022 Expertise in data compression for efficient 3D model storage and dissemination.\n\u2022 Experience with real-time 3D rendering and optimization for low-power devices.\n\u2022 Familiarity with US Army geospatial end-user devices (e.g., ATAK, GWS).\n\u2022 Knowledge of machine learning for automated feature extraction and model simplification (3D data models).\n\u2022 Understanding of geospatial data standards for interoperability.\n\u2022 Field work experience in geospatial data collection, testing, and evaluation.\n\u2022 Understanding of geodetic principles, 3D/2D registration, and georeferencing.\n\u2022 Experience with survey control data collection, post-processing, and product generation (GPS, Total Station).\n\nGeneral Skillsets:\n\u2022 Inherently curious, innovative, and a natural problem solver.\n\u2022 Ability to design and complete R&D projects.\n\u2022 Experience working as a team member and team leader.\n\u2022 Strong communication skills for presenting complex technical concepts to non-technical stakeholders.\n\u2022 Adaptability to rapidly evolving technologies and operational requirements.\n\u2022 Publishing experience in peer-reviewed journals or strong technical writing skills.\n\u2022 Statistical data analysis skills (preferred).\n\nAdditional Requirements:\n\u2022 Existing or eligible to obtain TS/SCI clearance.\n\u2022 Ideally local to Northern Virginia area (remote candidates considered).\n\u2022 Senior-level experience (not junior; able to be productive quickly).\n\u2022 Military/Army/DoD background highly beneficial (especially familiarity with fielded systems and use-cases).\n\nBenefits: Live an Extraordinary Life\nWe care about your well-being, not just on the job. Battelle offers comprehensive and competitive benefits to help you live your best life.\n\u2022 Balance life through a compressed work schedule: Most of our team follows a flexible, compressed work schedule that allows for every other Friday off\u2014giving you a dedicated day to accomplish things in your personal life without using vacation time.\n\u2022 Enjoy enhanced work flexibility, including a hybrid arrangement: You have options for where and when you work. Our Together with Flexibility model allows you to work 60% in-office and 40% remote, with Monday and Tuesday as common in-office days, dependent on team and position needs.\n\u2022 Take time to recharge: You get paid time off to support work-life balance and keep motivated.\n\u2022 Prioritize wellness: Stay healthy with medical, dental, and vision coverage with wellness incentives and benefits plus a variety of optional supplemental benefits.\n\u2022 Better together: Coverage for partners, gender-affirming care and health support, and family formation support.\n\u2022 Build your financial future: Build financial stability with an industry-leading 401(k) retirement savings plan. For most employees, we put in 5 percent whether you contribute or not, and match your contributions on top of that.\n\u2022 Advance your education: Tuition assistance is available to pursue higher education.\n\nA Work Environment Where You Succeed\nFor brilliant minds in science, technology, engineering and business operations, Battelle is the place to do the greatest good by solving humanity\u2019s most pressing challenges and creating a safer, healthier and more secure world.\n\nYou will have the opportunity to thrive in a culture that inspires you to:\n\u2022 Apply your talent to challenging and meaningful projects\n\u2022 Receive select funding to pursue ideas in scientific and technological discovery\n\u2022 Partner with world-class experts in a collaborative environment\n\u2022 Nurture and develop the next generation of scientific leaders\n\u2022 Give back to and improve our communities\n\nVaccinations & Safety Protocols\n\nBattelle may require employees, based on job duties, work location, and/or its clients\u2019 requirements to follow certain safety protocols and to be vaccinated against a variety of viruses, bacteria, and diseases as a condition of employment and continued employment and to provide documentation that they are fully vaccinated. If applicable, Battelle will provide reasonable accommodations based on a qualified disability or medical condition through the Americans with Disabilities Act or the Rehabilitation Act or for a sincerely held religious belief under Title VII of the Civil Rights Act of 1964 (and related state laws).\n\nBattelle is an equal opportunity employer. We provide employment and opportunities for advancement, compensation, training, and growth according to individual merit, without regard to race, color, religion, sex (including pregnancy), national origin, sexual orientation, gender identity or expression, marital status, age, genetic information, disability, veteran-status veteran or military status, or any other characteristic protected under applicable Federal, state, or local law. Our goal is for each staff member to have the opportunity to grow to the limits of their abilities and to achieve personal and organizational objectives. We will support positive programs for equal treatment of all staff and full utilization of all qualified employees at all levels within Battelle.\n\nThe above statements are intended to describe the nature and level of work being performed by people assigned to this job. They are not intended to be an exhaustive list of all responsibilities, activities and skills required of staff members. No statement herein is intended to imply any authorities to commit Battelle unless special written permission is granted by Battelle's Legal Department.\n\nFor more information about our other openings, please visit www.battelle.org/careers", "apply_link": "https://jobs.battelle.org/us/en/job/75741/Data-Scientist-IV?utm_campaign=google_jobs_apply&utm_source=google_jobs_apply&utm_medium=organic", "score": 0.73, "summary": "Skills Match (57%): R, Insurance, Python...", "skills": {"primary_skills": ["Adaptability", "Communication", "Data Analysis", "Data Visualization", "Flexibility", "Insurance", "Machine Learning", "Python", "R"], "secondary_skills": [], "all_skills": ["Adaptability", "Communication", "Data Analysis", "Data Visualization", "Flexibility", "Insurance", "Machine Learning", "Python", "R"], "skill_frequency": {"Python": 1, "R": 1, "Machine Learning": 2, "Data Analysis": 1, "Data Visualization": 2, "Communication": 1, "Adaptability": 1, "Flexibility": 2, "Insurance": 1}, "total_count": 9}, "keywords": ["r", "insurance", "python", "machine learning"], "evidence_image": null}, {"title": "Data Scientist", "company": "ClinLab Solutions Group", "location": "Charlottesville", "description": "Data Scientist\u2014Charlottesville, VA\n\nPosition Description\n\nOur client is seeking a data scientist to help lead the development of their digital solution. This individual should have domain expertise in computational science, including but not limited to:\n\u2022 Computational biology, computational chemistry, computational physics/mechanics, materials modeling and simulation.\n\u2022 As one of the earliest scientific hires, this individual will design computational frameworks that integrate numerical simulation, materials modeling, data analysis, and machine learning.\n\u2022 This role includes significant scientific ownership, the opportunity to serve as the Principal Investigator (PI) on a federal commercialization grant (NSF), and direct influence over the company\u2019s technical direction, modeling strategy, and research roadmap.\n\nRequired Qualifications\n\u2022 Ph.D. in Biomedical or Chemical Engineering, Materials Science, Biology, Chemistry, or other relevant areas\n\u2022 Domain expertise in computational science, including but not limited to:\n\u2022 Computational Biology & Chemistry\n\u2022 Computational Physics & Mechanics\n\u2022 Materials Modeling & Simulation\n\u2022 Experience with software development in C/C++, Python, or other programming languages\n\u2022 Strong background in numerical analysis and optimization\n\u2022 Strong communication skills\n\u2022 Self-motivated individual who is enthusiastic about defining problems and exploring new ideas in a startup setting\n\nOptional Qualifications\n\u2022 Experience with data science and machine learning tools and frameworks (e.g., AWS/other cloud services, PyTorch, TensorFlow, etc.)\n\u2022 Industry experience\n\nWork Context\n\nThis role is primarily computer-based and involves developing computational models, running simulations, and collaborating with a multidisciplinary team of engineers, scientists, and clinical advisors. The environment is fast-paced and research-driven, with high autonomy and regular communication of scientific findings to both technical and non-technical stakeholders.\n\nWork takes place in a hybrid office/lab setting within a state-of-the-art accelerator space, with occasional interactions in lab or device development areas following standard safety practices. Decisions made in this role have significant impact on research direction, material design, and grant milestones, and the work includes a mix of routine computational tasks and complex, open-ended scientific challenges typical of an early-stage stages.", "apply_link": "https://www.linkedin.com/jobs/view/data-scientist-at-clinlab-solutions-group-4342340656?utm_campaign=google_jobs_apply&utm_source=google_jobs_apply&utm_medium=organic", "score": 0.7, "summary": "Skills Match (71%): Tensorflow, Python, Pytorch...", "skills": {"primary_skills": ["AWS", "C", "Communication", "Data Analysis", "Machine Learning", "Ownership", "PyTorch", "Python", "TensorFlow"], "secondary_skills": [], "all_skills": ["AWS", "C", "Communication", "Data Analysis", "Machine Learning", "Ownership", "PyTorch", "Python", "TensorFlow"], "skill_frequency": {"Python": 1, "C": 2, "TensorFlow": 1, "PyTorch": 1, "AWS": 1, "Machine Learning": 2, "Data Analysis": 1, "Communication": 2, "Ownership": 1}, "total_count": 9}, "keywords": ["tensorflow", "python", "pytorch", "aws", "machine learning"], "evidence_image": null}, {"title": "Mid-Level Data Scientist", "company": "ECS Federal, LLC", "location": "Springfield", "description": "ECS is seeking a Mid-Level Data Scientist to work in our Springfield, VA office.\n\nNOTE: This position is contingent upon Prime Contractor and Government Customer acceptance, validation of appropriate clearances, and approval by a cognizant Government Contracting Officer (CO). Following customer indoctrination, the selected candidate will be submitted for, and must pass, a Counterintelligence (CI) Polygraph. This position is also contingent upon candidate submission of a signed Letter of Intent (LoI) and completion of a Personnel Security Questionnaire (PSQ).\n\nThe selected candidate must have a basic understanding of GEOINT integration (i.e., collection, exploitation, analysis, and product delivery capabilities), as well as act as an AI/Automation/Augmentation Analyst (AAA) Analyst focused on automation.\n\nThe Foundation GEOINT (FG) NOX (SFP) manages customer mission requirements. The FG NOX (SFP):\n\u2022 Reports on NGA's FG mission readiness\n\u2022 Leads SF's international engagements\n\u2022 Assumes the role of Crisis Coordinator for SF (by providing oversight of crisis response activities to ensure expeditious support to customers and mission partners)\n\u2022 Integrates FG and intelligence data in an object-based framework in support of Non-Combatant Evacuation Operations (NEO) for the NEO Community, the Department of State, and other Federal customers\n\nResponsibilities:\n\u2022 Provide the FG NOX (SFP) with automation and augmentation support that connects databases and systems to streamline production and requirements data. Any automation and augmentation solutions created by the contractor should take into consideration any SFP modernization objectives including modernized database applications, NEO CONPLAN support, and other enterprise activities (e.g., Foundation Digital Twin, Farm to Table and Crisis Response).\n\u2022 Provide embedded GEOINT AAA expertise to assure continuity of product and service provision to the NSG.\n\u2022 Deliver service solutions that integrate best practices to modernize current practices.\n\u2022 Connect databases from various sources to collect and assemble information in order to create finished products.\n\u2022 Search and retrieve data from several NGA databases, GEO squirrel, Print on Demand (POD) website, Aeronautical website, hydrographic website, etc.\n\u2022 Assist with sanitizing classified data from listings before moving to a lower classified system.\n\u2022 Gather, store, and disseminate metrics, data, and information between in-house and enterprise system.\n\u2022 Assist in the development of a modernized data management workflow for all SFP programs through research and understanding of current SFP data management practices.\n\u2022 Coordinate utilization and sustainment of the new database management processes and workflows with database developers and analysts.\n\u2022 Ensure new workflows have the ability to be integrated seamlessly with our modernized database applications and enterprise-level APIs.\n\u2022 Automate repetitive data management tasks.\n\u2022 Participate in strategic development activities in accordance with stated NGA, Source (S), Foundation GEOINT Group (SF), and FG NOX (SFP) goals and objectives.\n\u2022 Other duties as assigned.\n\nRequirements:\n\u2022 US Citizen.\n\u2022 Active TS/SCI security clearance required to apply; must be able to pass a CounterIntelligence (CI) polygraph following customer indoctrination.\n\u2022 High School Diploma and 5+ years of relevant experience; alternatively, a Bachelors with 1 year of experience / Masters degree in a related field of study or a combination of military (5+ years), experience, training or certifications.\n\u2022 Ability to support Intelligence Community missions in operational environments.\n\u2022 Proficiency in Python for data science, automation, and analytics pipeline development.\n\u2022 Familiarization with architecting solutions for structured and unstructured datasets.\n\u2022 Hands-on experience with COTS platforms (Tableau, MATLAB, MapLarge) and GOTS capabilities for advanced statistical analysis.\n\u2022 Demonstrated experience building, maintaining, and querying complex databases.\n\u2022 Understanding of intelligence analysis workflows and how data science enables mission success.\n\u2022 Experience conducting multi-INT research and analysis to support operational requirements.\n\u2022 Ability to identify capability gaps and architect innovative technical solutions.\n\u2022 Ability to lead technical teams and mentor data scientists.\n\u2022 Exceptional communication skills\u2014translating complex technical concepts for non-technical stakeholders.\n\u2022 Independent operator comfortable working in ambiguous, fast paced environments.\n\nReq Benefits:\n\nhttps://ecstech.com/careers/benefits/\">https://ecstech.com/careers/benefits/", "apply_link": "https://www.indeed.com/viewjob?jk=c36a9a8e95ac6872&utm_campaign=google_jobs_apply&utm_source=google_jobs_apply&utm_medium=organic", "score": 0.57, "summary": "Skills Match (42%): Tableau, Python, Search...", "skills": {"primary_skills": ["Communication", "MATLAB", "Product Delivery", "Python", "Search", "Tableau", "Teams"], "secondary_skills": [], "all_skills": ["Communication", "MATLAB", "Product Delivery", "Python", "Search", "Tableau", "Teams"], "skill_frequency": {"Python": 1, "MATLAB": 1, "Tableau": 1, "Teams": 1, "Communication": 1, "Product Delivery": 1, "Search": 1}, "total_count": 7}, "keywords": ["tableau", "python", "search"], "evidence_image": null}, {"title": "Data Scientist", "company": "CACI", "location": "Sterling", "description": "Data Scientist\n\nJob Category: Science\n\nTime Type: Full time\n\nMinimum Clearance Required to Start: TS/SCI with Polygraph\n\nEmployee Type: Regular\n\nPercentage of Travel Required: Up to 10%\n\nType of Travel: Continental US\n\nAnticipated Posting End: 1/1/2099\n\nThe Opportunity:\n\nSeeking a Data Scientist to support model and algorithm development. The Data Scientist is responsible for identifying, acquiring, transforming and analyzing unique data to assess system performance and inform decision making. They will support data integration and modeling; asking and developing operations, planning and assessment questions; interpreting data made available by stakeholders and data owners; and supporting development teams building tools to alert, analyze and nominate alternatives.\n\nResponsibilities:\n\u2022 Provide statistical and mathematical support to analyze and interpret a wide range of data.\n\u2022 Interpret and analyze information needs, and design and implement data analysis projects to address those needs by incorporating best practices, appropriate data, models and algorithms as well as proven techniques from experience or research methods.\n\u2022 Conduct software planning tool Architecture and Engineering Analysis to ensure integration of existing and future models and algorithms are in compliance with policies, architecture and resources.\n\u2022 Document, analyze, and (as needed) enhance data conditioning processes that translate raw data inputs into decision-quality data products appropriate to the intended audience and software.\n\u2022 Design, develop, test, and communicate data analytics products (including data, applications and visualizations) from documented, repeatable methods, based in sound data engineering principles and applicable standards.\n\u2022 Leverage wide-ranging data sources (e.g., web traffic, customer requests for information, ingested data, stated and implied requirements, production databases, human capital data, etc.) to develop and communicate understanding of phenomena and trends to support alternatives, models and assessments.\n\u2022 Provide insights through repeatable, transparent analysis that will be used to inform decisions and software nominations\n\u2022 Assist in the construction of data sets and data views for use by the software development teams to utilize and communicate complex data sets meaningfully and appropriately.\n\u2022 Assist with implementation of statistical analysis process improvements and incorporation of statistical research into new analytical products and methods.\n\u2022 Generate and maintain reports, schematics and other documentation sufficient to maintain awareness of data ingest, conditioning and visualization processes and modify them as required.\n\nProvide continuous feedback and recommendations to the Product Owner.\n\u2022 Prepare reports, briefings, documents and evaluation of results as required.\n\nParticipate in SAFe Agile processes and be a contributing member of the cross functional and development team.\nSeasoned technical individual contributor\n\u2022 Works independently with limited supervision\n\u2022 May manage projects / processes\n\nQualifications:\n\nRequired:\n\u2022 Technical degree in Applied mathematics, physics, data science.\n\u2022 2-4 years experience developing models and algorithms in support of operational software\n\nDesired:\n\u2022 TS/SCI clearance with Poly\n\u2022 Master\u2019s degree in statistics, applied mathematics or physics\n\u2022 2-4 years of experience in model development\n\u2022 Experience working with RF data, systems and software\n\n________________________________________________________________________________________\n\nWhat You Can Expect:\n\nA culture of integrity.\n\nAt CACI, we place character and innovation at the center of everything we do. As a valued team member, you\u2019ll be part of a high-performing group dedicated to our customer\u2019s missions and driven by a higher purpose \u2013 to ensure the safety of our nation.\n\nAn environment of trust.\n\nCACI values the unique contributions that every employee brings to our company and our customers - every day. You\u2019ll have the autonomy to take the time you need through a unique flexible time off benefit and have access to robust learning resources to make your ambitions a reality.\n\nA focus on continuous growth.\n\nTogether, we will advance our nation's most critical missions, build on our lengthy track record of business success, and find opportunities to break new ground \u2014 in your career and in our legacy.\n\nYour potential is limitless. So is ours.\n\nLearn more about CACI here.\n\n________________________________________________________________________________________\n\nPay Range: There are a host of factors that can influence final salary including, but not limited to, geographic location, Federal Government contract labor categories and contract wage rates, relevant prior work experience, specific skills and competencies, education, and certifications. Our employees value the flexibility at CACI that allows them to balance quality work and their personal lives. We offer competitive compensation, benefits and learning and development opportunities. Our broad and competitive mix of benefits options is designed to support and protect employees and their families. At CACI, you will receive comprehensive benefits such as; healthcare, wellness, financial, retirement, family support, continuing education, and time off benefits. Learn more here.\n\nSince this position can be worked in more than one location, the range shown is the national average for the position.\n\nThe proposed salary range for this position is:\n$69,100-$141,500\n\nCACI is an Equal Opportunity Employer. All qualified applicants will receive consideration for employment without regard to race, color, religion, sex, pregnancy, sexual orientation, age, national origin, disability, status as a protected veteran, or any other protected characteristic.", "apply_link": "https://www.indeed.com/viewjob?jk=70c139d0ccb85909&utm_campaign=google_jobs_apply&utm_source=google_jobs_apply&utm_medium=organic", "score": 0.4, "summary": "Strong Resume Context Match (100%)", "skills": {"primary_skills": ["Agile", "Data Analysis", "Data Engineering", "Decision Making", "Flexibility", "Healthcare", "Teams"], "secondary_skills": [], "all_skills": ["Agile", "Data Analysis", "Data Engineering", "Decision Making", "Flexibility", "Healthcare", "Teams"], "skill_frequency": {"Teams": 2, "Data Analysis": 1, "Agile": 1, "Data Engineering": 1, "Flexibility": 1, "Decision Making": 1, "Healthcare": 1}, "total_count": 7}, "keywords": [], "evidence_image": null}]